{
  "id": "M",
  "buildingId": "wheeler",
  "sortIndex": 1,
  "displayName": "M",
  "elevationM": 2.25,
  "heightM": 4.5,
  "heightSource": "default",
  "verified": false,
  "outline": [
    [
      4.995,
      30.006
    ],
    [
      4.592,
      30.017
    ],
    [
      4.211,
      30.29
    ],
    [
      4.069,
      30.17
    ],
    [
      4.003,
      29.822
    ],
    [
      3.628,
      29.697
    ],
    [
      3.275,
      30.759
    ],
    [
      1.331,
      30.113
    ],
    [
      1.347,
      29.628
    ],
    [
      -0.581,
      28.988
    ],
    [
      -0.821,
      29.38
    ],
    [
      -2.193,
      28.924
    ],
    [
      -2.172,
      28.423
    ],
    [
      -4.067,
      27.793
    ],
    [
      -4.311,
      28.202
    ],
    [
      -5.651,
      27.756
    ],
    [
      -5.635,
      27.272
    ],
    [
      -7.596,
      26.62
    ],
    [
      -7.835,
      27.013
    ],
    [
      -9.142,
      26.578
    ],
    [
      -9.099,
      26.121
    ],
    [
      -11.059,
      25.469
    ],
    [
      -11.298,
      25.861
    ],
    [
      -12.671,
      25.405
    ],
    [
      -12.622,
      24.932
    ],
    [
      -14.55,
      24.291
    ],
    [
      -14.795,
      24.7
    ],
    [
      -16.134,
      24.254
    ],
    [
      -16.091,
      23.797
    ],
    [
      -18.052,
      23.145
    ],
    [
      -18.296,
      23.554
    ],
    [
      -23.851,
      21.708
    ],
    [
      -23.564,
      20.842
    ],
    [
      -21.962,
      21.374
    ],
    [
      -21.745,
      21.265
    ],
    [
      -21.668,
      21.363
    ],
    [
      -21.788,
      21.722
    ],
    [
      -21.766,
      22.31
    ],
    [
      -19.756,
      22.978
    ],
    [
      -19.626,
      22.586
    ],
    [
      -19.065,
      22.591
    ],
    [
      -18.479,
      20.826
    ],
    [
      -21.093,
      19.958
    ],
    [
      -21.212,
      19.991
    ],
    [
      -21.343,
      20.383
    ],
    [
      -21.528,
      20.394
    ],
    [
      -21.126,
      19.185
    ],
    [
      -22.841,
      18.615
    ],
    [
      -21.918,
      15.837
    ],
    [
      -20.268,
      16.386
    ],
    [
      -20.11,
      16.293
    ],
    [
      -18.726,
      12.127
    ],
    [
      4.817,
      19.951
    ],
    [
      4.85,
      20.234
    ],
    [
      3.872,
      23.175
    ],
    [
      3.911,
      23.333
    ],
    [
      5.561,
      23.881
    ],
    [
      4.133,
      28.178
    ],
    [
      3.757,
      28.053
    ],
    [
      3.566,
      28.189
    ],
    [
      3.474,
      28.086
    ],
    [
      3.55,
      27.857
    ],
    [
      3.958,
      27.993
    ],
    [
      4.089,
      27.927
    ],
    [
      4.23,
      27.503
    ],
    [
      4.165,
      27.372
    ],
    [
      2.727,
      26.894
    ],
    [
      2.564,
      26.949
    ],
    [
      2.075,
      28.419
    ],
    [
      1.966,
      28.31
    ],
    [
      2.129,
      27.82
    ],
    [
      2.063,
      27.69
    ],
    [
      -0.616,
      26.799
    ],
    [
      -1.202,
      28.564
    ],
    [
      -1.17,
      28.683
    ],
    [
      1.477,
      29.563
    ],
    [
      1.64,
      29.291
    ],
    [
      1.793,
      29.269
    ],
    [
      1.826,
      29.715
    ],
    [
      2.741,
      30.019
    ],
    [
      3.078,
      29.551
    ],
    [
      3.203,
      29.719
    ],
    [
      3.563,
      29.839
    ],
    [
      3.677,
      29.496
    ],
    [
      3.992,
      29.31
    ],
    [
      4.166,
      28.787
    ],
    [
      5.015,
      29.07
    ],
    [
      4.853,
      29.56
    ]
  ],
  "voids": [],
  "imageTransform": {
    "scale": 0.034432650236564215,
    "rotation": 0.3208525628518768,
    "tx": -49.312870123032575,
    "ty": 47.44405034294705
  },
  "nodes": [
    {
      "id": "wheeler-M-n000",
      "levelId": "M",
      "x": -18.043,
      "y": 18.13,
      "kind": "junction",
      "verified": false
    },
    {
      "id": "wheeler-M-n001",
      "levelId": "M",
      "x": 2.233,
      "y": 22.594,
      "kind": "junction",
      "verified": false
    },
    {
      "id": "wheeler-M-v01j",
      "levelId": "M",
      "x": 1.375,
      "y": 24.631,
      "kind": "junction",
      "verified": false
    },
    {
      "id": "wheeler-M-v01",
      "levelId": "M",
      "x": 0.883,
      "y": 26.655,
      "kind": "stair",
      "verified": false
    },
    {
      "id": "wheeler-M-v02",
      "levelId": "M",
      "x": -19.651,
      "y": 19.78,
      "kind": "stair",
      "verified": false
    },
    {
      "id": "wheeler-M-v03",
      "levelId": "M",
      "x": -21.511,
      "y": 17.504,
      "kind": "stair",
      "verified": false
    },
    {
      "id": "wheeler-M-v04",
      "levelId": "M",
      "x": 4.023,
      "y": 25.319,
      "kind": "stair",
      "verified": false
    },
    {
      "id": "wheeler-M-v05",
      "levelId": "M",
      "x": 2.649,
      "y": 20.928,
      "kind": "elevator",
      "verified": false
    }
  ],
  "edges": [
    {
      "id": "wheeler-M-e000a",
      "a": "wheeler-M-n000",
      "b": "wheeler-M-v01j",
      "kind": "corridor",
      "polyline": [
        [
          -18.043,
          18.13
        ],
        [
          -3.396,
          23.045
        ],
        [
          -3.28,
          22.891
        ],
        [
          -3.265,
          23.089
        ],
        [
          1.375,
          24.631
        ]
      ],
      "accessible": true,
      "access": "open",
      "verified": false
    },
    {
      "id": "wheeler-M-e000b",
      "a": "wheeler-M-v01j",
      "b": "wheeler-M-n001",
      "kind": "corridor",
      "polyline": [
        [
          1.375,
          24.631
        ],
        [
          1.375,
          24.631
        ],
        [
          1.505,
          24.565
        ],
        [
          1.82,
          23.618
        ],
        [
          1.962,
          23.519
        ],
        [
          2.233,
          22.594
        ]
      ],
      "accessible": true,
      "access": "open",
      "verified": false
    },
    {
      "id": "wheeler-M-v01-link",
      "a": "wheeler-M-v01j",
      "b": "wheeler-M-v01",
      "kind": "corridor",
      "polyline": [
        [
          1.375,
          24.631
        ],
        [
          0.883,
          26.655
        ]
      ],
      "accessible": true,
      "access": "open",
      "verified": false
    },
    {
      "id": "wheeler-M-v02-link",
      "a": "wheeler-M-n000",
      "b": "wheeler-M-v02",
      "kind": "corridor",
      "polyline": [
        [
          -18.043,
          18.13
        ],
        [
          -19.651,
          19.78
        ]
      ],
      "accessible": true,
      "access": "open",
      "verified": false
    },
    {
      "id": "wheeler-M-v03-link",
      "a": "wheeler-M-v02",
      "b": "wheeler-M-v03",
      "kind": "corridor",
      "polyline": [
        [
          -19.424,
          19.544
        ],
        [
          -21.511,
          17.504
        ]
      ],
      "accessible": true,
      "access": "open",
      "verified": false
    },
    {
      "id": "wheeler-M-v04-link",
      "a": "wheeler-M-v01j",
      "b": "wheeler-M-v04",
      "kind": "corridor",
      "polyline": [
        [
          1.53,
          24.49
        ],
        [
          4.023,
          25.319
        ]
      ],
      "accessible": true,
      "access": "open",
      "verified": false
    },
    {
      "id": "wheeler-M-v05-link",
      "a": "wheeler-M-n001",
      "b": "wheeler-M-v05",
      "kind": "corridor",
      "polyline": [
        [
          2.233,
          22.594
        ],
        [
          2.649,
          20.928
        ]
      ],
      "accessible": true,
      "access": "open",
      "verified": false
    }
  ],
  "rooms": [
    {
      "id": "wheeler-M-rM21",
      "number": "M21",
      "aliases": [],
      "category": "office",
      "group": "College Writing Programs",
      "levelId": "M",
      "polygon": [
        [
          -4.59,
          27.51
        ],
        [
          -4.655,
          27.38
        ],
        [
          -3.852,
          24.962
        ],
        [
          -2.871,
          25.288
        ],
        [
          -2.501,
          25.266
        ],
        [
          -2.066,
          24.503
        ],
        [
          -0.432,
          25.046
        ],
        [
          -0.427,
          25.193
        ],
        [
          -1.458,
          28.297
        ],
        [
          -1.812,
          28.434
        ]
      ],
      "doors": [
        {
          "edgeId": "wheeler-M-e000a",
          "t": 0.8959,
          "side": "left",
          "verified": false
        }
      ]
    },
    {
      "id": "wheeler-M-rM19",
      "number": "M19",
      "aliases": [],
      "category": "office",
      "group": "College Writing Programs",
      "levelId": "M",
      "polygon": [
        [
          -4.895,
          27.391
        ],
        [
          -8.211,
          26.289
        ],
        [
          -7.109,
          22.972
        ],
        [
          -6.957,
          22.841
        ],
        [
          -5.225,
          23.417
        ],
        [
          -5.181,
          23.613
        ],
        [
          -5.387,
          24.234
        ],
        [
          -5.344,
          24.43
        ],
        [
          -4.053,
          24.859
        ]
      ],
      "doors": [
        {
          "edgeId": "wheeler-M-e000a",
          "t": 0.6335,
          "side": "left",
          "verified": false
        }
      ]
    },
    {
      "id": "wheeler-M-rM13",
      "number": "M13",
      "aliases": [
        "Berkeley Connect"
      ],
      "category": "other",
      "group": "Berkeley Connect",
      "levelId": "M",
      "polygon": [
        [
          -18.793,
          22.754
        ],
        [
          -17.642,
          19.29